titulo,texto,data,fonte,url,origem,aspecto,sentimento,analises_detalhadas,relevancia,candidatos,regiao,tema,candidatos_mencionados
Rodrigo Pacheco rejeita medidas sobre saúde em Amazonas,"Em pronunciamento hoje, Rodrigo Pacheco rejeita um conjunto de medidas relacionadas a saúde. Durante evento em Amazonas, o político destacou a importância de priorizar este tema. Lula também comentou sobre o assunto, expressando opinião contrária. As medidas visam melhorar o atendimento no SUS e reduzir filas de espera. ",2025-06-06,UOL,https://exemplo.com/uol/saúde/14,UOL Notícias,outros,neutro,"[{'texto': 'Rodrigo Pacheco rejeita medidas sobre saúde em Amazonas', 'aspecto': 'outros', 'sentimento': 'neutro', 'relevancia': 0}, {'texto': 'Em pronunciamento hoje, Rodrigo Pacheco rejeita um conjunto de medidas relacionadas a saúde.', 'aspecto': 'outros', 'sentimento': 'neutro', 'relevancia': 0}, {'texto': 'Durante evento em Amazonas, o político destacou a importância de priorizar este tema.', 'aspecto': 'outros', 'sentimento': 'neutro', 'relevancia': 0}, {'texto': 'Lula também comentou sobre o assunto, expressando opinião contrária.', 'aspecto': 'outros', 'sentimento': 'neutro', 'relevancia': 0}, {'texto': 'As medidas visam melhorar o atendimento no SUS e reduzir filas de espera.', 'aspecto': 'outros', 'sentimento': 'neutro', 'relevancia': 0}]",5,,Amazonas,saúde,"['Rodrigo Pacheco', 'Lula']"
Cláudio Castro apresenta medidas sobre reforma em Sul,"Em pronunciamento hoje, Cláudio Castro apresenta um conjunto de medidas relacionadas a reforma. Durante evento em Sul, o político destacou a importância de priorizar este tema. Rodrigo Pacheco também comentou sobre o assunto, expressando opinião contrária. ",2025-05-20,UOL,https://exemplo.com/uol/reforma/15,UOL Notícias,outros,neutro,"[{'texto': 'Cláudio Castro apresenta medidas sobre reforma em Sul', 'aspecto': 'outros', 'sentimento': 'neutro', 'relevancia': 0}, {'texto': 'Em pronunciamento hoje, Cláudio Castro apresenta um conjunto de medidas relacionadas a reforma.', 'aspecto': 'outros', 'sentimento': 'neutro', 'relevancia': 0}, {'texto': 'Durante evento em Sul, o político destacou a importância de priorizar este tema.', 'aspecto': 'outros', 'sentimento': 'neutro', 'relevancia': 0}, {'texto': 'Rodrigo Pacheco também comentou sobre o assunto, expressando opinião contrária.', 'aspecto': 'outros', 'sentimento': 'neutro', 'relevancia': 0}]",4,,Sul,reforma,"['Cláudio Castro', 'Rodrigo Pacheco']"
Cláudio Castro discute medidas sobre educação em Norte,"Em pronunciamento hoje, Cláudio Castro discute um conjunto de medidas relacionadas a educação. Durante evento em Norte, o político destacou a importância de priorizar este tema. Lula também comentou sobre o assunto, expressando opinião contrária. O plano prevê investimentos em escolas públicas e valorização dos professores. ",2025-05-20,Estadão,https://exemplo.com/estadão/educação/1,Estadão Política,outros,neutro,"[{'texto': 'Cláudio Castro discute medidas sobre educação em Norte', 'aspecto': 'outros', 'sentimento': 'neutro', 'relevancia': 0}, {'texto': 'Em pronunciamento hoje, Cláudio Castro discute um conjunto de medidas relacionadas a educação.', 'aspecto': 'outros', 'sentimento': 'neutro', 'relevancia': 0}, {'texto': 'Durante evento em Norte, o político destacou a importância de priorizar este tema.', 'aspecto': 'outros', 'sentimento': 'neutro', 'relevancia': 0}, {'texto': 'Lula também comentou sobre o assunto, expressando opinião contrária.', 'aspecto': 'outros', 'sentimento': 'neutro', 'relevancia': 0}, {'texto': 'O plano prevê investimentos em escolas públicas e valorização dos professores.', 'aspecto': 'outros', 'sentimento': 'neutro', 'relevancia': 0}]",5,,Norte,educação,"['Cláudio Castro', 'Lula']"
Arthur Lira veta medidas sobre educação em Brasília,"Em pronunciamento hoje, Arthur Lira veta um conjunto de medidas relacionadas a educação. Durante evento em Brasília, o político destacou a importância de priorizar este tema. Cláudio Castro também comentou sobre o assunto, expressando opinião contrária. O plano prevê investimentos em escolas públicas e valorização dos professores. ",2025-05-30,Estadão,https://exemplo.com/estadão/educação/2,Estadão Política,outros,neutro,"[{'texto': 'Arthur Lira veta medidas sobre educação em Brasília', 'aspecto': 'outros', 'sentimento': 'neutro', 'relevancia': 0}, {'texto': 'Em pronunciamento hoje, Arthur Lira veta um conjunto de medidas relacionadas a educação.', 'aspecto': 'outros', 'sentimento': 'neutro', 'relevancia': 0}, {'texto': 'Durante evento em Brasília, o político destacou a importância de priorizar este tema.', 'aspecto': 'outros', 'sentimento': 'neutro', 'relevancia': 0}, {'texto': 'Cláudio Castro também comentou sobre o assunto, expressando opinião contrária.', 'aspecto': 'outros', 'sentimento': 'neutro', 'relevancia': 0}, {'texto': 'O plano prevê investimentos em escolas públicas e valorização dos professores.', 'aspecto': 'outros', 'sentimento': 'neutro', 'relevancia': 0}]",5,,Brasília,educação,"['Arthur Lira', 'Cláudio Castro']"
Arthur Lira apresenta medidas sobre reforma em Sul,"Em pronunciamento hoje, Arthur Lira apresenta um conjunto de medidas relacionadas a reforma. Durante evento em Sul, o político destacou a importância de priorizar este tema. Cláudio Castro também comentou sobre o assunto, expressando opinião contrária. ",2025-06-01,Estadão,https://exemplo.com/estadão/reforma/3,Estadão Política,outros,neutro,"[{'texto': 'Arthur Lira apresenta medidas sobre reforma em Sul', 'aspecto': 'outros', 'sentimento': 'neutro', 'relevancia': 0}, {'texto': 'Em pronunciamento hoje, Arthur Lira apresenta um conjunto de medidas relacionadas a reforma.', 'aspecto': 'outros', 'sentimento': 'neutro', 'relevancia': 0}, {'texto': 'Durante evento em Sul, o político destacou a importância de priorizar este tema.', 'aspecto': 'outros', 'sentimento': 'neutro', 'relevancia': 0}, {'texto': 'Cláudio Castro também comentou sobre o assunto, expressando opinião contrária.', 'aspecto': 'outros', 'sentimento': 'neutro', 'relevancia': 0}]",4,,Sul,reforma,"['Arthur Lira', 'Cláudio Castro']"
Lula critica medidas sobre judiciário em Norte,"Em pronunciamento hoje, Lula critica um conjunto de medidas relacionadas a judiciário. Durante evento em Norte, o político destacou a importância de priorizar este tema. Tarcísio de Freitas também comentou sobre o assunto, expressando opinião contrária. ",2025-05-09,Estadão,https://exemplo.com/estadão/judiciário/4,Estadão Política,outros,neutro,"[{'texto': 'Lula critica medidas sobre judiciário em Norte', 'aspecto': 'outros', 'sentimento': 'neutro', 'relevancia': 0}, {'texto': 'Em pronunciamento hoje, Lula critica um conjunto de medidas relacionadas a judiciário.', 'aspecto': 'outros', 'sentimento': 'neutro', 'relevancia': 0}, {'texto': 'Durante evento em Norte, o político destacou a importância de priorizar este tema.', 'aspecto': 'outros', 'sentimento': 'neutro', 'relevancia': 0}, {'texto': 'Tarcísio de Freitas também comentou sobre o assunto, expressando opinião contrária.', 'aspecto': 'outros', 'sentimento': 'neutro', 'relevancia': 0}]",4,,Norte,judiciário,"['Lula', 'Tarcísio de Freitas']"
Arthur Lira anuncia medidas sobre inflação em Rio de Janeiro,"Em pronunciamento hoje, Arthur Lira anuncia um conjunto de medidas relacionadas a inflação. Durante evento em Rio de Janeiro, o político destacou a importância de priorizar este tema. Lula também comentou sobre o assunto, expressando opinião contrária. ",2025-05-12,Estadão,https://exemplo.com/estadão/inflação/5,Estadão Política,outros,neutro,"[{'texto': 'Arthur Lira anuncia medidas sobre inflação em Rio de Janeiro', 'aspecto': 'outros', 'sentimento': 'neutro', 'relevancia': 0}, {'texto': 'Em pronunciamento hoje, Arthur Lira anuncia um conjunto de medidas relacionadas a inflação.', 'aspecto': 'outros', 'sentimento': 'neutro', 'relevancia': 0}, {'texto': 'Durante evento em Rio de Janeiro, o político destacou a importância de priorizar este tema.', 'aspecto': 'outros', 'sentimento': 'neutro', 'relevancia': 0}, {'texto': 'Lula também comentou sobre o assunto, expressando opinião contrária.', 'aspecto': 'outros', 'sentimento': 'neutro', 'relevancia': 0}]",4,,Rio de Janeiro,inflação,"['Arthur Lira', 'Lula']"
Eduardo Leite anuncia medidas sobre saúde em Rio de Janeiro,"Em pronunciamento hoje, Eduardo Leite anuncia um conjunto de medidas relacionadas a saúde. Durante evento em Rio de Janeiro, o político destacou a importância de priorizar este tema. Tarcísio de Freitas também comentou sobre o assunto, expressando opinião contrária. As medidas visam melhorar o atendimento no SUS e reduzir filas de espera. ",2025-05-30,Estadão,https://exemplo.com/estadão/saúde/6,Estadão Política,outros,neutro,"[{'texto': 'Eduardo Leite anuncia medidas sobre saúde em Rio de Janeiro', 'aspecto': 'outros', 'sentimento': 'neutro', 'relevancia': 0}, {'texto': 'Em pronunciamento hoje, Eduardo Leite anuncia um conjunto de medidas relacionadas a saúde.', 'aspecto': 'outros', 'sentimento': 'neutro', 'relevancia': 0}, {'texto': 'Durante evento em Rio de Janeiro, o político destacou a importância de priorizar este tema.', 'aspecto': 'outros', 'sentimento': 'neutro', 'relevancia': 0}, {'texto': 'Tarcísio de Freitas também comentou sobre o assunto, expressando opinião contrária.', 'aspecto': 'outros', 'sentimento': 'neutro', 'relevancia': 0}, {'texto': 'As medidas visam melhorar o atendimento no SUS e reduzir filas de espera.', 'aspecto': 'outros', 'sentimento': 'neutro', 'relevancia': 0}]",5,,Rio de Janeiro,saúde,"['Eduardo Leite', 'Tarcísio de Freitas']"
Lula questiona medidas sobre judiciário em Rio de Janeiro,"Em pronunciamento hoje, Lula questiona um conjunto de medidas relacionadas a judiciário. Durante evento em Rio de Janeiro, o político destacou a importância de priorizar este tema. Cláudio Castro também comentou sobre o assunto, expressando opinião contrária. ",2025-06-03,Estadão,https://exemplo.com/estadão/judiciário/7,Estadão Política,outros,neutro,"[{'texto': 'Lula questiona medidas sobre judiciário em Rio de Janeiro', 'aspecto': 'outros', 'sentimento': 'neutro', 'relevancia': 0}, {'texto': 'Em pronunciamento hoje, Lula questiona um conjunto de medidas relacionadas a judiciário.', 'aspecto': 'outros', 'sentimento': 'neutro', 'relevancia': 0}, {'texto': 'Durante evento em Rio de Janeiro, o político destacou a importância de priorizar este tema.', 'aspecto': 'outros', 'sentimento': 'neutro', 'relevancia': 0}, {'texto': 'Cláudio Castro também comentou sobre o assunto, expressando opinião contrária.', 'aspecto': 'outros', 'sentimento': 'neutro', 'relevancia': 0}]",4,,Rio de Janeiro,judiciário,"['Lula', 'Cláudio Castro']"
Lula discute medidas sobre corrupção em Rio de Janeiro,"Em pronunciamento hoje, Lula discute um conjunto de medidas relacionadas a corrupção. Durante evento em Rio de Janeiro, o político destacou a importância de priorizar este tema. Cláudio Castro também comentou sobre o assunto, expressando opinião contrária. As propostas incluem maior transparência e mecanismos de controle. ",2025-05-24,Estadão,https://exemplo.com/estadão/corrupção/8,Estadão Política,outros,neutro,"[{'texto': 'Lula discute medidas sobre corrupção em Rio de Janeiro', 'aspecto': 'outros', 'sentimento': 'neutro', 'relevancia': 0}, {'texto': 'Em pronunciamento hoje, Lula discute um conjunto de medidas relacionadas a corrupção.', 'aspecto': 'outros', 'sentimento': 'neutro', 'relevancia': 0}, {'texto': 'Durante evento em Rio de Janeiro, o político destacou a importância de priorizar este tema.', 'aspecto': 'outros', 'sentimento': 'neutro', 'relevancia': 0}, {'texto': 'Cláudio Castro também comentou sobre o assunto, expressando opinião contrária.', 'aspecto': 'outros', 'sentimento': 'neutro', 'relevancia': 0}, {'texto': 'As propostas incluem maior transparência e mecanismos de controle.', 'aspecto': 'outros', 'sentimento': 'neutro', 'relevancia': 0}]",5,,Rio de Janeiro,corrupção,"['Lula', 'Cláudio Castro']"
Eduardo Leite apresenta medidas sobre educação em Brasília,"Em pronunciamento hoje, Eduardo Leite apresenta um conjunto de medidas relacionadas a educação. Durante evento em Brasília, o político destacou a importância de priorizar este tema. Cláudio Castro também comentou sobre o assunto, expressando opinião contrária. O plano prevê investimentos em escolas públicas e valorização dos professores. ",2025-06-04,Estadão,https://exemplo.com/estadão/educação/9,Estadão Política,outros,neutro,"[{'texto': 'Eduardo Leite apresenta medidas sobre educação em Brasília', 'aspecto': 'outros', 'sentimento': 'neutro', 'relevancia': 0}, {'texto': 'Em pronunciamento hoje, Eduardo Leite apresenta um conjunto de medidas relacionadas a educação.', 'aspecto': 'outros', 'sentimento': 'neutro', 'relevancia': 0}, {'texto': 'Durante evento em Brasília, o político destacou a importância de priorizar este tema.', 'aspecto': 'outros', 'sentimento': 'neutro', 'relevancia': 0}, {'texto': 'Cláudio Castro também comentou sobre o assunto, expressando opinião contrária.', 'aspecto': 'outros', 'sentimento': 'neutro', 'relevancia': 0}, {'texto': 'O plano prevê investimentos em escolas públicas e valorização dos professores.', 'aspecto': 'outros', 'sentimento': 'neutro', 'relevancia': 0}]",5,,Brasília,educação,"['Eduardo Leite', 'Cláudio Castro']"
Rodrigo Pacheco questiona medidas sobre judiciário em Bahia,"Em pronunciamento hoje, Rodrigo Pacheco questiona um conjunto de medidas relacionadas a judiciário. Durante evento em Bahia, o político destacou a importância de priorizar este tema. Tarcísio de Freitas também comentou sobre o assunto, expressando opinião contrária. ",2025-05-13,Estadão,https://exemplo.com/estadão/judiciário/10,Estadão Política,outros,neutro,"[{'texto': 'Rodrigo Pacheco questiona medidas sobre judiciário em Bahia', 'aspecto': 'outros', 'sentimento': 'neutro', 'relevancia': 0}, {'texto': 'Em pronunciamento hoje, Rodrigo Pacheco questiona um conjunto de medidas relacionadas a judiciário.', 'aspecto': 'outros', 'sentimento': 'neutro', 'relevancia': 0}, {'texto': 'Durante evento em Bahia, o político destacou a importância de priorizar este tema.', 'aspecto': 'outros', 'sentimento': 'neutro', 'relevancia': 0}, {'texto': 'Tarcísio de Freitas também comentou sobre o assunto, expressando opinião contrária.', 'aspecto': 'outros', 'sentimento': 'neutro', 'relevancia': 0}]",4,,Bahia,judiciário,"['Rodrigo Pacheco', 'Tarcísio de Freitas']"
Rodrigo Pacheco apresenta medidas sobre congresso em Norte,"Em pronunciamento hoje, Rodrigo Pacheco apresenta um conjunto de medidas relacionadas a congresso. Durante evento em Norte, o político destacou a importância de priorizar este tema. Tarcísio de Freitas também comentou sobre o assunto, expressando opinião contrária. ",2025-05-30,Estadão,https://exemplo.com/estadão/congresso/11,Estadão Política,congresso,neutro,"[{'texto': 'Rodrigo Pacheco apresenta medidas sobre congresso em Norte', 'aspecto': 'congresso', 'sentimento': 'neutro', 'relevancia': 1}, {'texto': 'Em pronunciamento hoje, Rodrigo Pacheco apresenta um conjunto de medidas relacionadas a congresso.', 'aspecto': 'congresso', 'sentimento': 'neutro', 'relevancia': 1}, {'texto': 'Durante evento em Norte, o político destacou a importância de priorizar este tema.', 'aspecto': 'outros', 'sentimento': 'neutro', 'relevancia': 0}, {'texto': 'Tarcísio de Freitas também comentou sobre o assunto, expressando opinião contrária.', 'aspecto': 'outros', 'sentimento': 'neutro', 'relevancia': 0}]",4,,Norte,congresso,"['Rodrigo Pacheco', 'Tarcísio de Freitas']"
Arthur Lira discute medidas sobre saúde em Bahia,"Em pronunciamento hoje, Arthur Lira discute um conjunto de medidas relacionadas a saúde. Durante evento em Bahia, o político destacou a importância de priorizar este tema. Lula também comentou sobre o assunto, expressando opinião contrária. As medidas visam melhorar o atendimento no SUS e reduzir filas de espera. ",2025-05-29,Estadão,https://exemplo.com/estadão/saúde/12,Estadão Política,outros,neutro,"[{'texto': 'Arthur Lira discute medidas sobre saúde em Bahia', 'aspecto': 'outros', 'sentimento': 'neutro', 'relevancia': 0}, {'texto': 'Em pronunciamento hoje, Arthur Lira discute um conjunto de medidas relacionadas a saúde.', 'aspecto': 'outros', 'sentimento': 'neutro', 'relevancia': 0}, {'texto': 'Durante evento em Bahia, o político destacou a importância de priorizar este tema.', 'aspecto': 'outros', 'sentimento': 'neutro', 'relevancia': 0}, {'texto': 'Lula também comentou sobre o assunto, expressando opinião contrária.', 'aspecto': 'outros', 'sentimento': 'neutro', 'relevancia': 0}, {'texto': 'As medidas visam melhorar o atendimento no SUS e reduzir filas de espera.', 'aspecto': 'outros', 'sentimento': 'neutro', 'relevancia': 0}]",5,,Bahia,saúde,"['Arthur Lira', 'Lula']"
Tarcísio de Freitas defende medidas sobre inflação em Norte,"Em pronunciamento hoje, Tarcísio de Freitas defende um conjunto de medidas relacionadas a inflação. Durante evento em Norte, o político destacou a importância de priorizar este tema. Cláudio Castro também comentou sobre o assunto, expressando opinião contrária. ",2025-05-26,Estadão,https://exemplo.com/estadão/inflação/13,Estadão Política,outros,neutro,"[{'texto': 'Tarcísio de Freitas defende medidas sobre inflação em Norte', 'aspecto': 'outros', 'sentimento': 'neutro', 'relevancia': 0}, {'texto': 'Em pronunciamento hoje, Tarcísio de Freitas defende um conjunto de medidas relacionadas a inflação.', 'aspecto': 'outros', 'sentimento': 'neutro', 'relevancia': 0}, {'texto': 'Durante evento em Norte, o político destacou a importância de priorizar este tema.', 'aspecto': 'outros', 'sentimento': 'neutro', 'relevancia': 0}, {'texto': 'Cláudio Castro também comentou sobre o assunto, expressando opinião contrária.', 'aspecto': 'outros', 'sentimento': 'neutro', 'relevancia': 0}]",4,,Norte,inflação,"['Tarcísio de Freitas', 'Cláudio Castro']"
Eduardo Leite critica medidas sobre inflação em Bahia,"Em pronunciamento hoje, Eduardo Leite critica um conjunto de medidas relacionadas a inflação. Durante evento em Bahia, o político destacou a importância de priorizar este tema. Tarcísio de Freitas também comentou sobre o assunto, expressando opinião contrária. ",2025-05-15,Estadão,https://exemplo.com/estadão/inflação/14,Estadão Política,outros,neutro,"[{'texto': 'Eduardo Leite critica medidas sobre inflação em Bahia', 'aspecto': 'outros', 'sentimento': 'neutro', 'relevancia': 0}, {'texto': 'Em pronunciamento hoje, Eduardo Leite critica um conjunto de medidas relacionadas a inflação.', 'aspecto': 'outros', 'sentimento': 'neutro', 'relevancia': 0}, {'texto': 'Durante evento em Bahia, o político destacou a importância de priorizar este tema.', 'aspecto': 'outros', 'sentimento': 'neutro', 'relevancia': 0}, {'texto': 'Tarcísio de Freitas também comentou sobre o assunto, expressando opinião contrária.', 'aspecto': 'outros', 'sentimento': 'neutro', 'relevancia': 0}]",4,,Bahia,inflação,"['Eduardo Leite', 'Tarcísio de Freitas']"
Arthur Lira aprova medidas sobre reforma em Brasília,"Em pronunciamento hoje, Arthur Lira aprova um conjunto de medidas relacionadas a reforma. Durante evento em Brasília, o político destacou a importância de priorizar este tema. Eduardo Leite também comentou sobre o assunto, expressando opinião contrária. ",2025-05-12,Estadão,https://exemplo.com/estadão/reforma/15,Estadão Política,outros,neutro,"[{'texto': 'Arthur Lira aprova medidas sobre reforma em Brasília', 'aspecto': 'outros', 'sentimento': 'neutro', 'relevancia': 0}, {'texto': 'Em pronunciamento hoje, Arthur Lira aprova um conjunto de medidas relacionadas a reforma.', 'aspecto': 'outros', 'sentimento': 'neutro', 'relevancia': 0}, {'texto': 'Durante evento em Brasília, o político destacou a importância de priorizar este tema.', 'aspecto': 'outros', 'sentimento': 'neutro', 'relevancia': 0}, {'texto': 'Eduardo Leite também comentou sobre o assunto, expressando opinião contrária.', 'aspecto': 'outros', 'sentimento': 'neutro', 'relevancia': 0}]",4,,Brasília,reforma,"['Arthur Lira', 'Eduardo Leite']"
Eduardo Leite defende medidas sobre inflação em Brasília,"Em pronunciamento hoje, Eduardo Leite defende um conjunto de medidas relacionadas a inflação. Durante evento em Brasília, o político destacou a importância de priorizar este tema. Lula também comentou sobre o assunto, expressando opinião contrária. ",2025-05-28,Folha,https://exemplo.com/folha/inflação/1,Folha de São Paulo,outros,neutro,"[{'texto': 'Eduardo Leite defende medidas sobre inflação em Brasília', 'aspecto': 'outros', 'sentimento': 'neutro', 'relevancia': 0}, {'texto': 'Em pronunciamento hoje, Eduardo Leite defende um conjunto de medidas relacionadas a inflação.', 'aspecto': 'outros', 'sentimento': 'neutro', 'relevancia': 0}, {'texto': 'Durante evento em Brasília, o político destacou a importância de priorizar este tema.', 'aspecto': 'outros', 'sentimento': 'neutro', 'relevancia': 0}, {'texto': 'Lula também comentou sobre o assunto, expressando opinião contrária.', 'aspecto': 'outros', 'sentimento': 'neutro', 'relevancia': 0}]",4,,Brasília,inflação,"['Eduardo Leite', 'Lula']"
Tarcísio de Freitas rejeita medidas sobre eleições em Sul,"Em pronunciamento hoje, Tarcísio de Freitas rejeita um conjunto de medidas relacionadas a eleições. Durante evento em Sul, o político destacou a importância de priorizar este tema. Rodrigo Pacheco também comentou sobre o assunto, expressando opinião contrária. ",2025-06-04,Folha,https://exemplo.com/folha/eleições/2,Folha de São Paulo,outros,neutro,"[{'texto': 'Tarcísio de Freitas rejeita medidas sobre eleições em Sul', 'aspecto': 'outros', 'sentimento': 'neutro', 'relevancia': 0}, {'texto': 'Em pronunciamento hoje, Tarcísio de Freitas rejeita um conjunto de medidas relacionadas a eleições.', 'aspecto': 'outros', 'sentimento': 'neutro', 'relevancia': 0}, {'texto': 'Durante evento em Sul, o político destacou a importância de priorizar este tema.', 'aspecto': 'outros', 'sentimento': 'neutro', 'relevancia': 0}, {'texto': 'Rodrigo Pacheco também comentou sobre o assunto, expressando opinião contrária.', 'aspecto': 'outros', 'sentimento': 'neutro', 'relevancia': 0}]",4,,Sul,eleições,"['Tarcísio de Freitas', 'Rodrigo Pacheco']"
Rodrigo Pacheco rejeita medidas sobre reforma em Rio de Janeiro,"Em pronunciamento hoje, Rodrigo Pacheco rejeita um conjunto de medidas relacionadas a reforma. Durante evento em Rio de Janeiro, o político destacou a importância de priorizar este tema. Arthur Lira também comentou sobre o assunto, expressando opinião contrária. ",2025-06-03,Folha,https://exemplo.com/folha/reforma/3,Folha de São Paulo,outros,neutro,"[{'texto': 'Rodrigo Pacheco rejeita medidas sobre reforma em Rio de Janeiro', 'aspecto': 'outros', 'sentimento': 'neutro', 'relevancia': 0}, {'texto': 'Em pronunciamento hoje, Rodrigo Pacheco rejeita um conjunto de medidas relacionadas a reforma.', 'aspecto': 'outros', 'sentimento': 'neutro', 'relevancia': 0}, {'texto': 'Durante evento em Rio de Janeiro, o político destacou a importância de priorizar este tema.', 'aspecto': 'outros', 'sentimento': 'neutro', 'relevancia': 0}, {'texto': 'Arthur Lira também comentou sobre o assunto, expressando opinião contrária.', 'aspecto': 'outros', 'sentimento': 'neutro', 'relevancia': 0}]",4,,Rio de Janeiro,reforma,"['Rodrigo Pacheco', 'Arthur Lira']"
Cláudio Castro apresenta medidas sobre judiciário em Norte,"Em pronunciamento hoje, Cláudio Castro apresenta um conjunto de medidas relacionadas a judiciário. Durante evento em Norte, o político destacou a importância de priorizar este tema. Lula também comentou sobre o assunto, expressando opinião contrária. ",2025-05-24,Folha,https://exemplo.com/folha/judiciário/4,Folha de São Paulo,outros,neutro,"[{'texto': 'Cláudio Castro apresenta medidas sobre judiciário em Norte', 'aspecto': 'outros', 'sentimento': 'neutro', 'relevancia': 0}, {'texto': 'Em pronunciamento hoje, Cláudio Castro apresenta um conjunto de medidas relacionadas a judiciário.', 'aspecto': 'outros', 'sentimento': 'neutro', 'relevancia': 0}, {'texto': 'Durante evento em Norte, o político destacou a importância de priorizar este tema.', 'aspecto': 'outros', 'sentimento': 'neutro', 'relevancia': 0}, {'texto': 'Lula também comentou sobre o assunto, expressando opinião contrária.', 'aspecto': 'outros', 'sentimento': 'neutro', 'relevancia': 0}]",4,,Norte,judiciário,"['Cláudio Castro', 'Lula']"
